<?xml version="1.0" encoding="UTF-8"?>
<IECManifest xmlns="http://www.iec.ch/CC/2017/IECManifest" xmlns:xsi="http://www.w3.org/2001/XMLSchema-instance" xsi:schemaLocation="http://www.iec.ch/CC/2017/IECManifest IECManifest.xsd">
	<Copyright>
		<Notice>
			COPYRIGHT (c) IEC, 2017. This version of this XSD is part of IEC 61850-6:2009; see the IEC 61850-6:2009 for full legal notices. In case of any differences between the here-below code and the IEC published content, the here-below definition supersedes the IEC publication; it may contain updates. See history files. The whole document has to be taken into account to have a full description of this code component.
			See www.iec.ch/CCv1 for copyright details.
		</Notice>
		<License uri="www.iec.ch/CCv1">IEC License</License>
	</Copyright>
	<CodeComponent id="IEC_61850-6.2007B.SCL.XSD" name="IEC 61850-6 SCL schema V2007B" content="full" date="2014-01-22">
		<Publication name="IEC_61850-6.2009_ed2.0" comment="Configuration description language for communication in power utility automation systems related to IEDs"/>
		<File name="SCL.xsd" category="normative" content="full"/>
		<File name="SCL_Substation.xsd" category="normative" content="full"/>
		<File name="SCL_Communication.xsd" category="normative" content="full"/>
		<File name="SCL_IED.xsd" category="normative" content="full"/>
		<File name="SCL_DataTypeTemplates.xsd" category="normative" content="full"/>
		<File name="SCL_BaseTypes.xsd" category="normative" content="full"/>
		<File name="SCL_BaseSimpleTypes.xsd" category="normative" content="full"/>
		<File name="SCL_Enums.xsd" category="normative" content="full"/>
		<File name="SCL.Doc.HTML.zip" category="normative" content="full" comment="Zip archive containing the HTML documentation of the SCL. Contains the 'SCL.html' file and all related pictures"/>
		<HistoryFile name="history3.0.txt" startingDate="2006-04-30" endingDate="2009-07-03" startingVersion="IEC_61850-6.2.0.SCL.XSD" endingVersion="IEC_61850-6.3.0.SCL.XSD"/>
		<HistoryFile name="history.2007B.txt" startingDate="2009-12-02" endingDate="2014-01-22" startingVersion="IEC_61850-6.3.0.SCL.XSD" endingVersion="IEC_61850-6.2007B.SCL.XSD"/>
	</CodeComponent>
</IECManifest>
